{
  "id": "ark-ui",
  "name": "Ark UI",
  "category": "accessible-ui-foundation",
  "homepage": "https://ark-ui.com",
  "repository": "https://github.com/chakra-ui/ark",
  "frameworks": [
    "react",
    "vue",
    "solid"
  ],
  "technologies": [
    "typescript",
    "zag-js"
  ],
  "dependency_model": "npm",
  "delivery_model": "npm-package",
  "access_class": "open-source",
  "license": "MIT",
  "license_reference": "https://github.com/chakra-ui/ark/blob/main/LICENSE",
  "redistribution": "redistributable",
  "attribution_required": true,
  "trust_tier": 2,
  "maintenance": "active",
  "documentation_quality": "good",
  "accessibility_maturity": "high",
  "performance_characteristics": "state-machine driven (zag-js), tree-shakeable",
  "suitable_contexts": [
    "multi-framework design systems",
    "web app"
  ],
  "unsuitable_contexts": [
    "vanilla-only projects"
  ],
  "strengths": [
    "headless components across React, Vue and Solid",
    "built on Zag state machines from the Chakra team"
  ],
  "weaknesses": [
    "requires own styling"
  ],
  "evidence": [
    "https://ark-ui.com",
    "https://github.com/chakra-ui/ark/blob/main/LICENSE"
  ],
  "last_reviewed": "2026-06-27",
  "confidence": "high",
  "status": "verified"
}
