{
  "id": "konva",
  "name": "Konva",
  "category": "canvas-particles-generative",
  "homepage": "https://konvajs.org",
  "repository": "https://github.com/konvajs/konva",
  "frameworks": [
    "vanilla",
    "react",
    "vue"
  ],
  "technologies": [],
  "dependency_model": "npm",
  "delivery_model": "mixed",
  "access_class": "open-source",
  "license": "MIT",
  "license_reference": "https://github.com/konvajs/konva/blob/master/LICENSE",
  "redistribution": "redistributable",
  "attribution_required": true,
  "trust_tier": 2,
  "maintenance": "active",
  "documentation_quality": "good",
  "accessibility_maturity": "low",
  "performance_characteristics": "layered canvas scene graph; re-renders on animation/interaction",
  "suitable_contexts": [
    "marketing",
    "immersive"
  ],
  "unsuitable_contexts": [
    "low-power-device",
    "enterprise app"
  ],
  "strengths": [
    "layered 2D canvas scene graph with hit detection and events",
    "official react-konva and vue-konva wrappers"
  ],
  "weaknesses": [
    "continuous re-render on animation drains battery on low-power devices",
    "memory overhead for large node counts"
  ],
  "evidence": [
    "https://konvajs.org",
    "https://github.com/konvajs/konva",
    "https://github.com/konvajs/konva/blob/master/LICENSE"
  ],
  "last_reviewed": "2026-06-27",
  "confidence": "high",
  "status": "verified"
}
