{
  "id": "adobe-spectrum",
  "name": "Adobe Spectrum",
  "category": "enterprise-design-system",
  "homepage": "https://spectrum.adobe.com",
  "repository": "https://github.com/adobe/react-spectrum",
  "frameworks": [
    "react"
  ],
  "technologies": [],
  "dependency_model": "varies",
  "delivery_model": "mixed",
  "access_class": "open-source",
  "license": "Apache-2.0 (React Spectrum code); Spectrum guidance and brand are Adobe's",
  "license_reference": "https://github.com/adobe/react-spectrum/blob/main/LICENSE",
  "redistribution": "adaptable-concept",
  "attribution_required": true,
  "trust_tier": 2,
  "maintenance": "active",
  "documentation_quality": "good",
  "accessibility_maturity": "high",
  "performance_characteristics": "varies by component",
  "suitable_contexts": [
    "enterprise app",
    "motion token and easing reference"
  ],
  "unsuitable_contexts": [
    "reskinning as Adobe/Spectrum brand"
  ],
  "strengths": [
    "documented motion/animation design tokens and easing curves",
    "strong accessibility and enterprise interaction principles (via React Aria foundation)"
  ],
  "weaknesses": [
    "React Spectrum code is Apache-2.0 but Spectrum visual guidance and brand are Adobe's (reference-only)",
    "adapt motion tokens/principles; treat guidance and brand as reference-only"
  ],
  "evidence": [
    "https://github.com/adobe/react-spectrum/blob/main/LICENSE",
    "https://spectrum.adobe.com"
  ],
  "last_reviewed": "2026-06-27",
  "confidence": "high",
  "status": "verified"
}
