{
  "id": "svelte-bits",
  "name": "Svelte Bits",
  "category": "animated-component-collection",
  "homepage": "https://sveltebits.xyz",
  "repository": "https://github.com/DavidHDev/svelte-bits",
  "frameworks": ["svelte"],
  "technologies": ["Svelte", "GSAP", "Three.js", "Tailwind"],
  "dependency_model": "copy-in + cli",
  "delivery_model": "mixed",
  "access_class": "source-available",
  "license": "MIT + Commons Clause",
  "license_reference": "https://github.com/DavidHDev/svelte-bits/blob/main/LICENSE.md",
  "redistribution": "reference-only",
  "attribution_required": true,
  "trust_tier": 3,
  "maintenance": "active",
  "documentation_quality": "good",
  "accessibility_maturity": "low",
  "performance_characteristics": "varies by component; some heavy WebGL/GSAP effects",
  "suitable_contexts": ["marketing", "landing pages"],
  "unsuitable_contexts": ["enterprise app", "products that redistribute the components"],
  "strengths": ["official Svelte port of React Bits", "growing animated gallery"],
  "weaknesses": ["Commons Clause forbids selling/redistributing/porting the components themselves; concept reference only", "still being ported incrementally; smaller than React/Vue Bits", "low a11y maturity"],
  "evidence": ["https://sveltebits.xyz", "https://github.com/DavidHDev/svelte-bits", "https://github.com/DavidHDev/svelte-bits/blob/main/LICENSE.md"],
  "last_reviewed": "2026-06-27",
  "confidence": "high",
  "status": "verified"
}
