{
  "id": "reka-ui",
  "name": "Reka UI",
  "category": "accessible-ui-foundation",
  "homepage": "https://reka-ui.com",
  "repository": "https://github.com/unovue/reka-ui",
  "frameworks": [
    "vue"
  ],
  "technologies": [],
  "dependency_model": "varies",
  "delivery_model": "mixed",
  "access_class": "open-source",
  "license": "MIT",
  "license_reference": "https://github.com/unovue/reka-ui/blob/main/LICENSE",
  "redistribution": "redistributable",
  "attribution_required": true,
  "trust_tier": 3,
  "maintenance": "active",
  "documentation_quality": "good",
  "accessibility_maturity": "medium",
  "performance_characteristics": "varies by component",
  "suitable_contexts": [
    "vue app"
  ],
  "unsuitable_contexts": [],
  "strengths": [
    "Vue accessible primitives (Radix-Vue successor)"
  ],
  "weaknesses": [],
  "evidence": [
    "https://reka-ui.com",
    "https://github.com/unovue/reka-ui"
  ],
  "last_reviewed": "2026-06-27",
  "confidence": "medium",
  "status": "verified"
}
